{
  "schemaVersion": 6,
  "program": "cost_diamond_drop",
  "chainId": 4663,
  "dropId": "0x3333333333333333333333333333333333333333333333333333333333333333",
  "rewardAsset": {
    "tokenAddress": "0x4EA005168D7F09a7A0Ba9D1DEf21a479950E44C2",
    "distributorAddress": "0x00000000000000000000000000000000000000D4",
    "symbol": "COST",
    "name": "Costco Robinhood Stock Token",
    "decimals": 18
  },
  "assetContextHash": "0xe28ae785edc5af2b5e94033bd7ea827a026976df4a43bedc71a227626c64951c",
  "window": {
    "sequence": 1,
    "startBlock": "1000",
    "endBlock": "1105",
    "rulesVersion": "1.0.0",
    "rulesPath": "rules/RULES-v1.md",
    "rulesSha256": "b80cc1e93fac35292aa1bce7beb537e4cd5f181260d3f35d01889a4dfbc797b9",
    "selection": {
      "selectionId": "0x1111111111111111111111111111111111111111111111111111111111111111",
      "minimumDurationBlocks": "100",
      "maximumDurationBlocks": "200",
      "minimumEndBlock": "1099",
      "maximumEndBlock": "1199",
      "selectedDurationBlocks": "106",
      "entropyBlockNumber": "1264",
      "entropyBlockHash": "0x2222222222222222222222222222222222222222222222222222222222222222",
      "randomWord": "0xf50842da74f420ae7d4c3220eb92b3a7eff3c2329a95ef1ae1ce269f99a7f95a",
      "rejectionCount": 0
    }
  },
  "rewardAmount": "1000000000000000001",
  "floorTokenAmount": "5000000000000000000",
  "eligibilityRule": "no_outbound_cheap_transfer",
  "eligibleCount": 2,
  "totalWeight": "33000000000000000000",
  "holderSnapshotHash": "0xe37b64cabb357c7794e02cd85c339d65f3435c8f405cecdb03ab347b7d1d76a5",
  "holderSnapshot": [
    {
      "address": "0x00000000000000000000000000000000000000A1",
      "minimumBalance": "10000000000000000000",
      "streak": 1,
      "outboundTransfer": false,
      "excluded": false
    },
    {
      "address": "0x00000000000000000000000000000000000000b2",
      "minimumBalance": "90000000000000000000",
      "streak": 10,
      "outboundTransfer": true,
      "excluded": false
    },
    {
      "address": "0x00000000000000000000000000000000000000C3",
      "minimumBalance": "20000000000000000000",
      "streak": 2,
      "outboundTransfer": false,
      "excluded": false
    }
  ],
  "allocationRoot": "0x7f23ae76716db039afe42e98cc4e22e0c29d743257025906c1ad7091cccc92de",
  "batchesRoot": "0x282ba5652c678e8f861df7b4afc08ee0721b88320c63ce854a0fe571c4378761",
  "expectedBatches": 1,
  "safeCreateDropCalldata": "0x183ec14633333333333333333333333333333333333333333333333333333333333333337f23ae76716db039afe42e98cc4e22e0c29d743257025906c1ad7091cccc92de282ba5652c678e8f861df7b4afc08ee0721b88320c63ce854a0fe571c43787610000000000000000000000000000000000000000000000000de0b6b3a76400010000000000000000000000000000000000000000000000000000000000000001",
  "safeFinalizeDropCalldata": "0xd1ffe5903333333333333333333333333333333333333333333333333333333333333333",
  "safeCreateDropTransaction": {
    "to": "0x00000000000000000000000000000000000000D4",
    "value": "0",
    "data": "0x183ec14633333333333333333333333333333333333333333333333333333333333333337f23ae76716db039afe42e98cc4e22e0c29d743257025906c1ad7091cccc92de282ba5652c678e8f861df7b4afc08ee0721b88320c63ce854a0fe571c43787610000000000000000000000000000000000000000000000000de0b6b3a76400010000000000000000000000000000000000000000000000000000000000000001"
  },
  "safeFinalizeDropTransaction": {
    "to": "0x00000000000000000000000000000000000000D4",
    "value": "0",
    "data": "0xd1ffe5903333333333333333333333333333333333333333333333333333333333333333"
  },
  "allocations": [
    {
      "address": "0x00000000000000000000000000000000000000A1",
      "minimumBalance": "10000000000000000000",
      "streak": 1,
      "outboundTransfer": false,
      "multiplierBps": "10000",
      "weight": "10000000000000000000",
      "amount": "303030303030303031",
      "leaf": "0x25d21dc9fcbc3209b4e046d2c07ca0a0a2035971b55da79518e4695fda0840db",
      "proof": [
        "0xa219676a6fb0bcd01aa922a7e9de951ca80a5b58c0dab8d125c2d99ec4ca9765"
      ]
    },
    {
      "address": "0x00000000000000000000000000000000000000C3",
      "minimumBalance": "20000000000000000000",
      "streak": 2,
      "outboundTransfer": false,
      "multiplierBps": "11500",
      "weight": "23000000000000000000",
      "amount": "696969696969696970",
      "leaf": "0xa219676a6fb0bcd01aa922a7e9de951ca80a5b58c0dab8d125c2d99ec4ca9765",
      "proof": [
        "0x25d21dc9fcbc3209b4e046d2c07ca0a0a2035971b55da79518e4695fda0840db"
      ]
    }
  ],
  "batches": [
    {
      "index": 0,
      "recipients": [
        "0x00000000000000000000000000000000000000A1",
        "0x00000000000000000000000000000000000000C3"
      ],
      "amounts": [
        "303030303030303031",
        "696969696969696970"
      ],
      "batchHash": "0xd15f1eb9e96d8bca9542d82deb72626620f4afad853de2b3a630516c27b53491",
      "leaf": "0x282ba5652c678e8f861df7b4afc08ee0721b88320c63ce854a0fe571c4378761",
      "proof": [],
      "operatorCalldata": "0x01baf7273333333333333333333333333333333333333333333333333333333333333333000000000000000000000000000000000000000000000000000000000000000000000000000000000000000000000000000000000000000000000000000000a000000000000000000000000000000000000000000000000000000000000001000000000000000000000000000000000000000000000000000000000000000160000000000000000000000000000000000000000000000000000000000000000200000000000000000000000000000000000000000000000000000000000000a100000000000000000000000000000000000000000000000000000000000000c3000000000000000000000000000000000000000000000000000000000000000200000000000000000000000000000000000000000000000004349474804cd93700000000000000000000000000000000000000000000000009ac223f271726ca0000000000000000000000000000000000000000000000000000000000000000",
      "operatorTransaction": {
        "to": "0x00000000000000000000000000000000000000D4",
        "value": "0",
        "data": "0x01baf7273333333333333333333333333333333333333333333333333333333333333333000000000000000000000000000000000000000000000000000000000000000000000000000000000000000000000000000000000000000000000000000000a000000000000000000000000000000000000000000000000000000000000001000000000000000000000000000000000000000000000000000000000000000160000000000000000000000000000000000000000000000000000000000000000200000000000000000000000000000000000000000000000000000000000000a100000000000000000000000000000000000000000000000000000000000000c3000000000000000000000000000000000000000000000000000000000000000200000000000000000000000000000000000000000000000004349474804cd93700000000000000000000000000000000000000000000000009ac223f271726ca0000000000000000000000000000000000000000000000000000000000000000"
      }
    }
  ]
}
